id,postid,score,text,creationdate,userid,jsonfield
2141,1038,0,I am indeed talking about the exact same beer in bottles and kegs. Another example would be Tripel Karmeliet. Tastes waaaaay better bottled :).,2014-10-09 14:57:04.01,662,
2143,1051,2,"I would suggest you trim down your question pretty seriously.  I'm going to try to answer some of the more cogent points, but there's a lot to this post that's unnecessary to the question and gives the sense of ""drinking craft beer makes me cool"".  I apologize if that's phrased offensively, but I think you'll spur a lot better discussion if you rephrase your post with less editorializing.",2014-10-17 13:20:27.333,268,
2144,889,2,"Just my two pennies worth, but becks is my fav beer and since moving to usa I have struggled to find something like it coz its hard to find here, but I did try sam adams boston lager and hated it! I'm still hunting lol.....",2014-10-16 05:31:23.173,,
2189,1067,1,If you want to get drunk and not take in calories try drinking clear liquours...,2014-12-02 14:44:39.57,1547,
2145,1051,0,Agreed w/ @Sloloem. The narrative doesn't clarify or add substance to your question. Please trim your question soon. I'm willing but prefer not to have to make such large edits and speak for someone who isn't me.,2014-10-19 21:47:08.003,73,
2146,1052,0,"An excellent answer and worthy of a model for this site, IMO. Thank you.",2014-10-19 21:48:50.517,73,
2147,1038,0,I have read in an article that the tripel beer in a keg an bottled tripel beer is the exact same. I still don't know where the difference in taste comes from though.,2014-10-21 11:31:12.14,662,
2148,1053,2,"A lot of these are seasonal or limited brewery-only releases. Others are simply hard to find, even though they may be distributed officially in a given state. IMO the [Beers of Fame](http://www.beeradvocate.com/lists/fame/) list is better - I can get 32 of the top 100 beers within 10 miles or so of where I live (maybe more, those were just the ones I remember seeing).",2014-10-22 03:38:51.333,288,
2150,1053,0,"I've had at least 15 on that list (as of this comment's typing). And I recognize many more from either specialty beer/liquor stores, or some of the more generous grocery stores I've been to. Some are only available from the brewpubs, sadly",2014-10-24 18:46:42.44,49,
2151,548,0,ironic that 40s are illegal there,2014-10-24 18:47:56.577,49,
2152,1059,0,"that's something to be said of beer being skunked while in the glass, before drinking. All it takes is a few minutes of sunlight. Guess the older guys figured it out by trial and error first.",2014-10-27 20:49:24.667,467,
2154,1067,0,"What do you mean by ""Diet"" beer? Calorie-free or low-calorie beer?",2014-11-04 21:40:25.96,793,
2155,1067,0,As low calories as possible,2014-11-04 21:41:27.477,1452,
2156,890,0,"@ChrisMarasti-Georg Okay, I do not agree with the green bottle theory. If this is true, why does becks and also Heineken from a can taste skunky? I'll tell you the answer, this is how these beers naturally taste. Also, Beck's is brewed in St. Louis.",2014-11-05 05:06:05.18,1454,
2159,889,0,"Löwenbräu is very similar, you can call to see if it's available in your area (united states) 1-800-DIAL BUD according to wikipedia, they use the same recipe as beck's and unlike beck's it's still imported from Germany.",2014-11-05 09:09:17.907,1454,
2160,638,0,"Intended to be eaten with seafood? Stout is, generally, not a style that I'd eat with seafood.",2014-11-05 14:59:21.14,192,
2161,890,1,"@mchid Don't confuse skunky with sulfur-y.  It's been pretty well proven that UV light will cause alpha acids from hops in beer to break down and smell like a skunk: http://www.popsci.com/science/article/2013-01/beersci-why-you-should-never-drink-beer-clear-glass-bottle
Some lager beer will have a sulphur-y smell.  The aging process is supposed to clear this up, but if it's cut short intentionally or otherwise the smell will linger.  Some styles or brewers prefer this.",2014-11-05 17:33:51.533,268,
2162,890,1,"@mchid additionally, there's an odd amount of effort gone into some of these imports to make them taste ""off"", like they did when originally imported pre-prohibition.  While preservation techniques have improved, the desire for traditional taste came along with it, causing brewers to specifically introduce what they originally considered flaws.",2014-11-05 17:39:58.823,268,
2163,1068,5,"Additionally:  Lots of dry (rather than sweet) beers are fairly low calorie.  Guinness as an example only has 125 calories per 12 ounce serving, which is barely more than Bud Light.

Also session beers which are low in alcohol will also have fewer calories than their more boozy compatriots.",2014-11-05 17:44:30.35,268,
2165,1067,7,"The answer by Ryan is good, but on another tangent I might suggest that alcohol is likely not the best way to handle stress in your life.  You might want to consider other life changes like exercise, or removing stressors first.",2014-11-05 19:29:53.22,37,
2166,890,0,"@Sloloem when was prohibition in Germany? I wasn't aware it existed. Original German Beck's has a naturally skunky taste, not sulfur-y, it's one of the qualities of the beer that Beck's drinkers prefer. If you don't like it go drink Sam Adams but don't try and act like Sam Adams is better because it lacks character and flavor IMO Sam Adams is like eating a loaf of bread it's awful.",2014-11-06 01:16:00.483,1454,
2167,890,0,"@Sloloem Additionally, UV light does not penetrate a can which is exactly my point, maybe you want to read it again.",2014-11-06 01:24:05.783,1454,
2168,1070,1,"Perhaps you could describe your route more in more detail, _e.g._ what cities you're visiting, so that we can come up with specific recommendations rather than spanning the entire West Coast :-)",2014-11-06 18:25:30.38,73,
2169,1070,1,"Sure! From the top, WA: Seattle, Spokane, Bellingham. OR: Bend, Eugene, Portland, Salem. CA: Antioch, Sacramento, Marin, Yountville, Santa Rosa, Merced, Lodi, San Jose, Fresno, Monterey, Livermore, St Luis Obispo, Visalia, Glendale, Irvine, Escondido, Riverside.",2014-11-06 18:31:02.84,1457,
2172,890,0,"If the name is any clue, then St. Pauli beer should come from Hamburg.",2014-11-13 20:23:23.33,1469,
2173,771,0,"Perhaps they were awarded four crosses for producing such a poor beer. I'm Australian, and let me tell you, it is terrible. It has a reduced alcohol level, so it can be sold cheaper and more can be drunk under the hot Queensland sun.",2014-11-15 12:26:57.787,,
2174,1083,0,Very interesting answer. It would be useful to know a little more about the **special circumstances**.,2014-11-17 21:23:23.73,1493,
2175,1083,2,"The special circumstances are likely to generally be where the underlying illness itself would be exacerbated by alcohol (such as peptic ulcers) or the specific antibiotic, like Flagyl, causes a complication. note: I'm not a doctor",2014-11-18 09:27:19.073,909,
2176,739,0,"""Skunkiness"" is caused by light, and particularly UV light hitting the isohumulones that come from the hops.  It's not caused by heat so far as I know, but by all means provide a reference if you think I'm wrong.",2014-11-19 12:07:35.7,1503,
2177,219,0,"I took a look at that link.  Those are serving temperatures, not storage temperatures.",2014-11-19 12:11:46.757,1503,
2178,964,0,Some of what you said is wrong.  Please read my answer.,2014-11-19 15:12:02.067,1506,
2179,90,0,Some of what you said is wrong.  Please read my answer.,2014-11-19 15:12:18.377,1506,
2180,961,0,"A friend of mine always says ""no salad"" when ordering her corona. Maybe not as clear but definitely funny!",2014-11-20 04:49:01.913,1508,
2181,1084,0,This is not a medical site. It probably has a lot to do with which drugs and how much alcohol.,2014-11-20 17:25:56.26,381,
2182,1071,0,Lagunitas provides a fun brewery tour and the Bear Republic Pub in Healdsburg is quite charming. These would be good stops.,2014-11-21 18:17:56.683,1075,
2184,1037,0,Papazian also mentions this in Joy of Home Brewing.,2014-11-24 00:23:23.477,1521,
2185,361,0,It may have been used to avoid being poisoned as well.,2014-11-23 23:11:07.58,1520,
2186,1041,1,Your first paragraph is super confusing.,2014-11-25 15:14:27.26,1506,
2187,1096,0,"""Deglutenize"" sounds like ""reducing gluten"" to me which would mean they're not truly ""gluten free beers"".",2014-11-26 20:27:57.683,1506,
2188,991,1,"BeerAdvocate ISO:FT
Reddit Beer",2014-12-02 14:53:06.723,1547,
2190,1095,0,Do you have a [spectrophotometer](http://www.jenway.com/adminimages/A09_010A_Determination_of_Caffeine_in_Beverages_using_UV_Wavelength_Spectroscopy(1).pdf)?,2014-12-03 20:51:58.843,887,
2192,1073,0,"+1, excellent suggestions. Fremont Brewing in Seattle is also awesome!",2014-12-03 21:06:18.94,887,
2193,1084,0,"Look on the medicine bottles. If it says, ""Don't take with alcohol,"" you probably shouldn't take it with alcohol.",2014-12-03 21:10:06.66,887,
2194,1041,0,@im1dermike Noted and updated accordingly; see the bold/strike-through.,2014-12-06 13:48:17.43,1352,
2195,793,0,"Thanks for giving me an authoritative answer on ""why"".  I've accepted another answer that evaluates these claims more thoroughly, but I appreciate your help.",2014-12-07 03:00:12.453,43,
2196,1091,0,Green Flash being one of the better breweries in the area.,2014-12-08 15:00:59.403,1506,
2197,1091,0,"Green Flash has a nice brewery and tasting room to visit, but note that it is 30 miles away from Vista.",2014-12-08 16:15:19.257,1075,
2198,1091,0,The author said he's going to Escondido and Google Maps says Green Flash is 29 mins from there...,2014-12-09 14:08:19.203,1506,
2199,1124,3,"You've got good answers here, but I would suggest asking your question over on http://homebrew.stackexchange.com since this is way more up their alley.  Plus they have a larger user base so you might get more tips.",2014-12-10 14:06:50.01,268,
2200,1095,0,I suspect the alcohol content of the beer would throw off basic attempts to measure the caffeine.,2014-12-09 13:41:32.603,1569,
2201,1124,0,I didn't even know that existed - I just found this one and stopped here. Thanks!,2014-12-15 18:25:53.69,840,
2202,2128,0,To add a little more detail to my answer,2014-12-16 00:56:18.553,2574,
2203,2128,1,"I made a little more research and came with an interesting result.

There is higher excise duty in the Czech republic than it is for example in Germany or France while beer is more expensive in both countries.

What does it say is that of the three mentioned reasons there is one more - historical market prizes of beer. Beer market in the Czech republic is wide. Consumers want low prizes, more producers are willing to fight with lower prizes and therefore the prize on the market stays low (beer is not really a money maker in most Czech pubs)",2014-12-16 01:16:46.093,2574,
2204,2130,0,"It'd be really cool if you could translate the relevant text and include it in your answer.  That's the first time I've heard ABV mentioned in regards to food pairing, though I suppose it does make some sense, so it'd be cool to see a good quote.",2014-12-16 20:24:35.783,268,
2205,1118,1,"While pretty gross, I doubt there was anything harmful in the beer.",2014-12-16 20:27:16.14,268,
2207,2130,0,"I reread the post and saw I msread it: it does mention ABV, but not as a crucial factor as I read it the first time. The following comment is the translation.",2014-12-16 21:07:35.9,2585,
2208,2130,0,"Such opulence [of ingredients], due to the use of meat sauce, cheese and hard-boiled eggs [it is lasagna ""campana""], all dressed in sheets of pasta, goes well with a well structured craft beer, but with sharp ""weapons"" to de-grease the palate.
I would then suggest an amber ale, or a darker amber: caramel malts, rightly toasted - excessive roasting may in fact have to battle with ingredients such as tomatoes - that will give sensations and structure that hold the richness of the meat and the sauce. But not enough.",2014-12-16 21:08:17.777,2585,
2209,2130,1,"Our beer, we said, must also have the ability to "" clean up"" the palate, perhaps with a touch of citrus fruit or herbal, with a pleasant feeling of hops. Still, will absolutely not to be cloying [too sweet]. So we better prefer a product from the dry bitter and strong with good carbonation, since bubbles help the drinkability.

As for the alcohol, it would be preferable not to exceed, remaining between 6 and 7 degrees.",2014-12-16 21:08:48.13,2585,
2213,2140,0,"Thanks for the pointers.  I've just signed up with RateBeer and posted a question there asking if it's possible to import data from Beer Advocate ('cause doing that by hand would be rough).  That seems closer to what I'm looking for than Untapped, so I'm trying RB first.",2014-12-19 02:06:31.987,43,
2214,792,1,"@AndrewCheong: Omission is gluten-reduced, not gluten free.  See my answer below.",2014-12-19 20:32:05.573,1506,
2215,1086,0,"Though I didn't comment before, this is a great clarification; thanks for your input. I'd upvote you again if you could :-)",2014-12-19 21:14:54.223,73,
2216,2143,0,"That sounds odd, cause I read in multiple documents that tripel beers are supposed to be fermented, where as normal ""blondes"" don't. Anyway, thanks for the interesting article!!",2014-12-20 15:43:19.933,662,
2217,2144,1,"Welcome to Beer.SE! Could you possibly translate and quote some of the more pertinent parts of the linked article into your answer? Without that, I'm afraid this answer doesn't meet Stack Exchange's general quality requirements.",2014-12-22 03:57:22.753,73,
2218,2144,1,"That article seems to be about building a diet around drinking beer every day.  Idea seems to be that for 1 week a month you drink no more than 1 liter of beer every day, 2 liters of water, and eat very few calories (~800) focusing mostly on meat and veg and don't have too much salt.  Which is pretty much a regular diet, just with a codified beer allowance.  Including beer as part of calorie counting is definitely valid, but this seems like an odd approach.",2014-12-22 14:25:46.883,268,
2219,2148,0,I am pretty sure that is not the reason because I have tasted it multiple times in different bars. One of those bars is a bar of a friend of mine which I know takes this very seriously.,2014-12-22 15:46:03.24,662,
2220,2143,0,"This might sound kind of crass; but, all alcoholic beer has to be fermented. Not sure if your comment was complete thought (ie. tripples are supposed to be bottle conditioned). The other problem we might be having is interchanging words. Some aren't an issue (porter and stout, even though they were originally different styles they are more or less synonymous now)... The difference between ""bottle conditioned"" and ""fermented in a bottle"" is HUGE, though.",2014-12-22 21:29:24.513,22,
2221,2143,0,I really mean fermented in a bottle.,2014-12-22 22:41:19.687,662,
2222,2143,0,"Unless someone can correct me... You never *ferment* in the bottle. The bottle would explode from the violent reaction that is fermentation. After your primary fermentation, you can choose to rack the beer into a secondary fermentor that will help your beer clear or bottle the beer with a little added priming sugar. The former allows the beer to clarify more while the latter will more than likely yield a yeast cake in the bottom of your bottle.",2014-12-24 13:38:27.51,22,
2223,1053,0,I've seen bottle shops that post the Beer Advocate ratings with various beers.,2014-12-26 15:18:04.63,529,
2224,2158,0,"This doesn't seem to be a notable claim, can you provide some examples? Or is it simply your friends' idea?",2014-12-24 00:17:36.347,176,
3256,973,0,"lambics and shandies may help, too",2015-01-13 19:24:30.743,49,
3257,3195,0,Corona Extra _Dry_? I found a link to a beer store in [Japan](http://www.nisekowinesupply.com/showProduct/Beer+and+Mixers/Beer/BEER09003/Corona+Extra+Dry+330ml+6+bottle+pack) but it looks like the regular Corona Extra bottle. Nothing else comes up in Google or on Corona'a site.,2015-01-15 07:48:33.74,1289,
2225,2158,0,"Wit a little more searching I came across: [this source](http://www.binnys.com/blog/binnys-mailbag-re-refrigerating-beer/) that seems to suggest that it doesn't matter, and [this source](http://lemonlye.livejournal.com/80537.html) which seems to suggest that re-refrigerating is bad for beer, and *definitely* bad for wine. I did hear about this from my friends, though it seems to be a general superstition(?). There seems, however, to be [scientific evidence](https://beersensoryscience.wordpress.com/2011/03/17/lightstruck/) of beer being affected by light.",2014-12-24 00:43:45.743,,
2226,2158,0,"@oddthinking thanks for the edit. I figured the title needed work, couldn't figure out how to word it.",2014-12-26 03:43:00.503,,
2227,2158,0,@warren Good catch. I didn't even think to look for a beer-based SE... then again who would? Vote to close.,2014-12-29 16:32:55.073,,
2228,2158,0,@ChrisCirefice - who *wouldn't* think to look for beer-related questions on the Beer.SE? :),2014-12-29 18:16:42.707,49,
2229,2160,1,What kind of keg? Same keg every time or three different kegs? Did it leak beer or CO2? Filtered beer or yeasty homebrew?,2014-12-31 02:32:54.567,1289,
2230,2157,0,"Its worth noting that the Reinheitsgebot was not pointlessly restrictive at the time it was made though. When it was first instituted it gave consumers a lot of faith in getting quality beer free of potentially dangerous preservatives (not hops) and at a reasonable price (the law also set a fixed price for beer). Eventually the law definitely stifled brewers creativity to an unreasonable degree, but the beer market would likely have been set back hundreds of years without the law.",2014-12-31 16:06:10.21,2607,
2231,2157,0,"Also, aside from sours and outright fruit beers, much of the fruit flavors in Belgian beer is derived from just the malt and yeast. Just because you can taste hints of specific fruit does not mean the fruit is necessarily present. And by the way, the wild yeasts in Belgium that make great beer are the ones used in sours such as Lambics.",2014-12-31 16:10:41.983,2607,
2232,2160,0,"All different kegs. 2 purchased from the Ontario beer store (bud light) and 1 purchased from a Craft brewer (Beau's). The last couple of times it has leaked beer from the coupler. At least half an ounce a hour from my estimation. It was working well until the leak, and when i take the o ring out now, it is still foamy.",2015-01-01 00:11:34.82,2633,
2234,2165,0,But can I instead just give a one-number rating if that's all I want to bother with?,2015-01-01 01:41:20.83,43,
2235,2140,0,Untapped also has an API - so you can access your info via other sites such as [BrewFeed](http://www.brewfeed.com/) as well.,2015-01-02 19:37:47.653,2648,
2236,2159,0,Is it fair to assume this is then a non-issue for a canned beer within reasonable room temperatures?,2015-01-02 20:09:25.497,2648,
2237,2172,5,BTW this would be a better question for http://homebrew.stackexchange.com/,2015-01-04 08:34:55.147,1289,
2238,2165,0,Sorry misread your post. You can add notes for yourself in Beer Citizen. Untapped works well for what you are looking for.,2015-01-01 01:44:43.117,2633,
2239,2158,0,"@ChrisCirefice - Welcome to Beer.SE. Good question, but I believe it is a duplicate (which of course you couldn't have known while asking on Skeptics.SE). If the answers at the indicated duplicate don't satisfy you, please comment here to let us know.",2015-01-04 15:01:39.64,73,
2240,2159,0,+1 for pointing out the correlation between leaving beer out and exposure to light.,2015-01-04 15:02:25.333,73,
2241,2158,0,"@AndrewCheong I didn't know Beer.SE even existed when I posted this question to Skeptics.SE, so you're right, I had no idea there was a duplicate (though I would have easily found it if I had even thought to look for Beer.SE). That said, it is appropriately marked as duplicate. I appreciate the answers everyone has given regardless, but I'm waiting on feedback to [my Meta question](http://meta.stackexchange.com/questions/246366/migration-to-a-site-with-no-account-prevents-quick-account-deletion-feature) before I take any further action (votes/accept) on Beer.SE.",2015-01-04 20:06:43.223,2632,
2242,624,1,"Here is a great research paper if anyone is looking for specifics [Stability profile of flavour-active ester compounds in
ale and lager beer during storage](http://www.academicjournals.org/article/article1380728686_Hiralal%20et%20al.pdf)",2015-01-04 22:16:35.807,2639,
2243,2159,0,"Cans will be fine, yes. As for bottles brown ones can probably take a couple of days of light and be fine as brown glass blocks some 90% of light. Green only blocks around 40% though and clear nearly 0%, so I would not expose either of them unless I was drinking them. Of course its best to just keep everything someplace cool and dark.",2015-01-05 15:45:20.937,2607,
2244,2163,0,"I would agree with you.  The 2nd beer I put on tap was very temperamental and one thing I had to realize was that the setting on the regulator was the pressure of CO2 in the empty space of the keg, not necessarily the carbonation of the beer or even how much CO2 is coming out the tank.  Plus when you change the setting, it takes many hours to stabilize.  Also figure out some way to insulate the tap tower if you have one.  Warm beer in the upper foot of the tube has caused me lot of grief in the past.",2015-01-05 16:05:06.303,268,
2245,974,2,Good suggestion but I'm pretty sure Kriek is Flemish for sour cherry (see http://en.m.wikipedia.org/wiki/Kriek_lambic ),2015-01-07 01:20:09.11,1275,
3245,974,0,"@HNJSlater Good point, you are correct!",2015-01-07 09:08:16.657,662,
3246,2178,2,"Some of the resealable metal ones coming out recently actually look quite appealing.  Same reason micro-canning and portable cannery businesses are beginning to take off.  Metal containers like cans, kegs, or metal growlers offer 100% UV protection and they'll generally chill faster than glass.",2015-01-07 13:46:25.617,268,
3247,2170,0,"I have been served at least one ""White Stout"" that tasted like cream soda and had nothing to do with a stout, which just seems like marketing.",2015-01-08 15:19:58.033,198,
3248,3184,0,"Does the app provide a ranking as the OP asks? (If not, I may convert this answer into a comment.) In any case, interesting app—thanks, and welcome!",2015-01-12 02:16:15.177,73,
3250,1082,1,Alcohol and antibiotics is fine. Alcohol and acetaminophen is **not**: acetaminophen can wreak havoc on the liver by itself; with alcohol it is an extremely dangerous combination.,2015-01-11 19:48:35.447,3675,
3251,741,0,+1 for the tip on how to drink it without getting a mouth full of foam,2015-01-12 05:37:20.43,3676,
3252,1038,0,"There is no difference for bottling and kegging the same batch of beer in bottles versus kegs (for most breweries) because they force carbonate their bottles and kegs. The difference would come at the homebrew level, where, as people have stated. You add priming sugar to the bottled beer and force carbonate kegs (though you can add priming sugar to the kegged beer and then wait... I'm going to say that something tasting ""way better"" out of the bottle is a mental difference. Though, one could contest that the ability to let the beer breath in a glass changes the aroma and therefore the taste.",2015-01-12 21:04:50.51,22,
3253,3184,0,"Yes, in most cases depending on the obscurity of the beer. (e.g. Many reviews for Sierra Nevada beers, but only one of five Jester King beers are reviewed.)",2015-01-13 15:43:02.493,3675,
3255,2178,0,@Sloloem - though they also warm faster than glass,2015-01-13 19:15:48.56,49,
3258,3195,0,"Sorry, my mistake! I must have confused it with the name of Tooheys Extra Dry - another well known beer in Australia. I have fixed the question. Thanks for pointing it out.",2015-01-15 07:56:07.24,3676,
3259,2163,0,"To follow on Sloloem's comment about cooling the tap tower, a quick and relatively painless method is the one illustrated in [this Popular Mechanics article](http://www.popularmechanics.com/home/improvement/interior/fighting-foam-how-to-insulate-a-kegerator-draft-tower-16554310). It has worked very well for me and only took about 15 minutes of actual work.",2015-01-15 13:16:03.22,3675,
3260,3197,0,"I like this question, I just wish that I could answer it.  Probably anywhere with slightly different wind patterns or wind that crosses different plants.  From what I understand, a significant source of natural yeast is the skins of various fruits and grains.  IE grain husks, grape skins, etc.  So if you left one beer under a peach tree and another under an apple tree 100 feet apart you'd probably get different beers.  But it's all speculation, not a very useful answer.",2015-01-16 13:53:47.14,268,
3261,986,0,That's the man keeping you down,2015-01-19 07:26:40.587,1289,
3262,986,0,"Correct but for one thing, the target that sells full strength alcohol is in Glendale less than a mile from the King Soopers that does the same.",2015-01-17 02:50:47.817,,
3263,3196,0,Thanks for your prompt and helpful answer. The links to the website are particularly useful - I hadn't been aware of  that site before.,2015-01-22 09:59:19.953,3676,
3265,889,0,"@ApexAssassin Totally uncalled for.  Lager is great.  Ale is great.  IPA is great.  Stout is great.  Beer is great.  Drink beer, be great, don't hate.",2015-01-26 13:48:52.077,268,
3270,1105,0,They do share some of the same flavor. I remember doing the same thing going from Heineken to Lowenbrau years ago but they no longer make that brew.,2015-01-27 03:06:41.19,1454,
3271,1088,0,"Perhaps another question, but ""why"" the state made such a restrictive regulation is perplexing to me. Especially considering there is a liquor store on every corner in Denver and throughout Colorado as a whole.",2015-01-27 04:34:48.5,3721,
