id,postid,score,text,creationdate,userid,jsonfield
5778,5171,0,Regarding Ed Plunkett and user 23466; great answers! Thank you! You answered my question and concern I have had for many years and have denied myself the much enjoyed combination. Why some people have to be so literal is beyond me. Stress will hurt a lot more folks!,2018-10-03 20:52:15.287,8125,
5779,7509,0,"Personally, I prefer your answer since it is based on actual experience. Interestingly, I've also seen the term ""black wine"" applied to Malbecs from Cahors in France. Also a pretty opaque wine.",2018-10-04 14:14:24.803,6370,
5780,7509,0,"Any of those super dark wines I would say that food pairings would be similar. French Malbec could be as dark and tannic as Saperavi. For whatever reason, new world Malbecs aren't as tannic. I know my Malbecs were not",2018-10-04 14:16:17.62,6111,
5782,7514,0,thanks for inproving my grammar it is not that great yet,2018-10-11 13:41:54.16,8134,
5783,7503,0,May I suggest Wild Boar?,2018-10-13 17:22:07.19,6366,
5784,7503,0,@dougal5.0.0 You sure can.,2018-10-13 19:56:28.473,5064,
5785,6517,0,It is not common. I am surprised Jamie found one. +1 Jägermeister is common to be served cold but it is not a whiskey. If they serve beer in frozen mugs you could ask for a shot in a frozen beer mug.,2017-02-13 17:51:06.36,4903,
5786,7517,1,"Have an upvote for **most** of this answer. But be aware that saying that a particular way of drinking whisky is bad is, well, wrong. It is just an opinion. Some people like ice with some whiskies, some like water, and some like stones. They are all correct, and it doesn't help by treating them as if they are wrong. Any drink can be taken the way the individual prefers it.",2018-10-15 15:26:46.72,187,
5787,7151,0,Well my Wife drank threw a straw last night for no particular reason. And she was well drunk and I mean in all my years I have never seen her that drunk. She didn’t consume anymore than a normal night out. Had a good meal before we went out. So from a personal point YES! drinking via a straw does make you get drunk faster/worse.,2018-10-15 09:06:55.607,8152,
5788,7521,0,Plus they can hydrate you if the alcohol is low enough,2018-10-16 14:44:51.913,6111,
5789,7523,2,What are you asking here? Gluten is not related to sugar.,2018-10-16 21:14:53.473,187,
5790,7523,2,@RoryAlsop I'm guessing he's asking why distillation removes gluten but not sugar.,2018-10-16 21:55:42.947,6370,
5791,7523,0,@EricShain yes! I've updated the question.,2018-10-16 22:22:54.853,8158,
5792,7523,1,Probably a chemistry issue. I'm assuming fructose is much small molecule than gluten.,2018-10-16 23:12:56.303,6370,
5793,7151,0,No this is completely true from personal experience i am 23 and a straw does get u more drunk,2018-10-17 08:13:02.92,8160,
5794,7523,1,"I have made an edit to clarify your question. If it is not quite what you think it should be, please feel free to rollback it to the original form.",2018-10-18 13:22:57.193,5064,
5795,7523,0,"@KenGraham thanks. Overall i think it's better, but by the bold question at the end there seemed to be a mistake. I corrected it. Was it a mistake or did i misunderstand your edit?",2018-10-18 15:06:18.23,8158,
5796,7523,1,"I asked this question on the seasoned cooking exchange and got a few answers, Should I delete this question or post a link to the answers?",2018-10-18 15:09:58.407,8158,
5797,7523,0,I suspect they have different vapor pressure.,2018-10-18 17:54:57.98,4903,
5799,7432,0,Might be a better fit on homebrew.stackexchange.com.,2018-10-20 11:34:50.963,4903,
5800,7527,0,You're asking different things in the title and in the question itself.,2018-10-22 08:20:15.97,4742,
5801,7527,0,Yes you are right as i did ask differently in title and elaborate in question and i want overall review of tannin along with its usage and its different forms.,2018-10-22 09:44:36.777,8167,
5802,7527,0,You did some research? The results are not satisfying? Why? Please read [how to ask](https://alcohol.stackexchange.com/help/how-to-ask).,2018-10-22 09:49:59.297,4742,
5803,7527,1,Yah really. That one is so obviously solved by Wikipedia. https://en.wikipedia.org/wiki/Tannin,2018-10-22 14:29:43.587,6111,
5804,6517,1,"@dougal5.0.0 From personal experience - I wouldn’t recommend them. Similar to ice cubes, the stones often absorb foreign odors and tastes which ruin the beverage. Though granted I may have not been careful enough in how they were stored in the freezer (they come with a velvet-type bag).",2018-10-24 00:36:18.56,7965,
5805,7530,0,"Mostly on point, but I'd add that ice is much less common in Scotch than Bourbon. Most Scotch connoisseurs won't go further than adding a few drops of water to their whisky. But yes typically ice smooths out harsh liquors and helps it go down faster. Liquors good enough to be enjoyed on their own don't need ice.",2018-10-24 19:19:19.093,938,
5806,7528,0,"This is one of the most comprehensive answers I have ever seen on stack overflow and I think you deserve a high five. If our civilization ever tanks out and all that is left is stack overflow, then rest assured there will be exquisite wine in the rebuilding. 

Follow up question: 
Does cracking a bottle of red open and letting it sit for 30 mins actually release tannins and enhance the flavor?",2018-10-24 23:44:02.84,8176,
5807,7530,1,"Good take on q, though my personal experience when occasionally adding a few drops of water to a scotch (or bourbon), liken@mcraen observes, is not so much to dilute it but rather to open the body and “tweak” the taste - I’ve only added to really smokey scotches. Re. rums, I’ve only put a single rum in the freezer -and it was great (a Diplomatico)- but I typically don’t store it there. Not worth risking blunting the flavors. I’d imagine one should first taste each bottle as is and decide if too “spicy” and is doomed for the freezer. Ultimately, I agree - it’s all personal preference.",2018-10-25 12:59:36.723,7965,
5808,7531,2,"Some liquors are meant to be served cold, others not. If you want to drink the applicable ones at a colder temperature, go for it! One way or another you won't harm the liquor by cooling it down.",2018-10-25 18:19:53.19,938,
5809,3442,0,"Unfortunately Stone Brewing charges almost three times as much for their beer as any German beer anywhere else in the area. I'd love to patronize them, but I don't feel like being extorted. If you're near the north side of Berlin, I'd recommend Two Fellas. Their beer is excellent and much more reasonably priced.",2018-10-26 10:17:28.05,8179,
5810,7540,0,Just realised that this is a similar question to one below - any problems and I will happily remove it.,2018-10-28 05:52:43.49,6366,
5811,7540,1,Dilution would be a big factor.,2018-10-28 12:03:32.793,4903,
5812,7544,1,Made this a Community Wiki answer so that all can simply add on to a single response to this question that would be otherwords too broad.,2018-10-28 13:45:48.847,5064,
5813,7538,1,"Fearing this question would be too broad, I set up a Community Wiki answer for those interested.",2018-10-28 13:48:04.34,5064,
5814,7533,3,In Germany beer is *not* usually served at room temperature.,2018-10-29 13:35:07.727,3875,
5815,7547,0,"It tastes sour and watery, and smells like vinegar.",2018-10-30 13:30:51.133,8187,
5816,7546,1,"What do you call German style beers? Pilsener? Weizen (which is somewhat similar to Belgian witbiers) is top-fermented, Altbier is top-fermented, Kölsch is top-fermented. And the question is btw not about a German-style beers but about German beers.",2018-10-30 17:46:21.863,4742,
5817,7547,0,[same question (answered)](https://www.reddit.com/r/korea/comments/8mgkt1/my_boyfriend_bought_this_liquor_in_korea_and_cant/). Should we trust the source?,2018-10-30 15:11:19.183,8185,
5818,7547,0,@user3664452 The Reddit post looks like an empty bottle held by a female; OP’s has contents and [appears to be] held by a male :),2018-11-02 04:24:31.45,7965,
5819,6425,0,If i remember correctly there is one small trappist brewery in the netherlands as well.,2018-11-03 13:37:19.757,4638,
5820,6425,0,They are everywhere that the Catholic church is. Even in North America. A little googling will get you a long way.,2018-11-03 14:38:32.22,6111,
5821,7533,0,"I've never been to Germany myself so I based it off of other Americans visits and google results. But in any sense, I was just trying to make a point. I guess another example would be candy bars. You can store them in the freezer or eat them at room temperature, in either case it's a personal decision.",2018-11-05 00:46:44.54,8172,
5822,7546,0,"@ Altbier is not Old Beer  You are right. But when I think about German-style beers, I start thinking about helles, dunkel, keller, bock,...",2018-11-05 08:15:31.367,8185,
5823,6767,0,"The Yamazaki 12 is fairly hard to get anywhere due to surging demand and limited stocks of old spirit at Yamazaki, Mostly what you will find these days are the younger, no-age statement bottlings that they have started releasing to cover this shortfall.",2018-11-06 01:22:46.417,5619,
5824,4948,0,"The angel's share does not necessarily decrease alcohol content, it depends on the ambient humidity. It will always decrease volume obviously.",2018-11-06 01:27:07.953,5619,
5825,4948,0,"Sadly, the most volatile fractions will **always** be the first to go, @Jack",2018-11-06 18:50:33.3,187,
5826,4948,0,"wikipedia disagrees (https://en.wikipedia.org/wiki/Barrel#Angels'_share). I've heard this from other more reputable sources as well, but can't find a good one at the moment. Its a somewhat moot point as far as scotch is concerned, as nowhere is Scotland would ever be that dry.",2018-11-06 22:21:55.023,5619,
5827,4948,0,"AHH - I see what you mean. Yes, you wouldn't store your casks somewhere dry. You always control humidity.",2018-11-07 04:50:39.83,187,
5831,7542,2,"Seriously?!  Ken you always struck me as being one of the more sane members here - blimey, have you gone to the 'dark side'?!!!!! (Joking)",2018-11-11 06:14:20.337,6366,
5833,7542,2,@dougal5.0.0 You have no idea.,2018-11-12 14:54:51.407,5064,
5834,6976,0,"Not an api (?) but good info: https://wineinstitute.compliancerules.org/
If it exists, it will likely be on the list at ProgrammableWeb.com.",2018-11-20 07:55:23.91,8226,
5840,7573,0,Thank you @Eric Shain,2018-11-24 14:34:42.917,8230,
5841,7572,1,Bung. The hole is called the bung hole and now you know where that term came from!,2018-11-24 15:08:58.343,6111,
5842,7573,0,@kengraham Thanks for the edits!,2018-11-24 18:16:38.423,6370,
5843,7574,1,Might depend on if the scorpion went in under his own volition.,2018-11-25 16:48:37.323,5064,
5845,7578,0,Thank you for the answer @user3664452,2018-11-28 14:19:42.947,8230,
5846,7578,0,"The sweetness level in grapes does not mean that they are sweeter in the bottle. That is up to the winemaker. Also, adding sugar is mostly against the law in Europe, except in some places. In the USA, it mostly allowed but hardly used since most of our grapes get ripe enough.",2018-11-28 23:19:30.017,6111,
5847,7580,1,Curious if the scorpion is dead and *then* placed in the vodka or inserted alive and then dies.,2018-11-29 04:42:28.417,7965,
5848,7577,2,Possible duplicate of [How to know which wine goes with which type of food](https://alcohol.stackexchange.com/questions/4979/how-to-know-which-wine-goes-with-which-type-of-food),2018-11-29 17:40:54.53,6111,
5849,7582,0,"Of course the sugars & acids would have to be adjusted but I doubt that should be such an obstacle for expert vintners. IAE, helpful input.",2018-11-30 04:09:22.227,7965,
5851,7547,0,"@Oliver I didn't want to question the OP. I meant: can I use Reddit as a reliable source for my answer? (Incidentally, from the answer by farmersteve I guess that, at least in this case, Reddit was a reliable source)",2018-11-30 08:24:42.503,8185,
5854,7309,0,"Beer Advocate has given it an aggregate rating of 2.37 / 5. Might I recommend instead of looking for a replica, look for something that's better?",2018-12-04 19:58:34.493,938,
5855,7586,1,You might need to ask this on the Chemistry SE site.,2018-12-05 17:30:40.797,6370,
5856,7587,0,"Thanks so much! I am going to try using the sodium tricitrate to break up the emulsion - will comment to say what happens. But also will keep in mind lightly heating for next time. All the combination of liquids occurred at cold temps, so good to know for next time.",2018-12-06 15:00:26.02,8269,
5858,7587,0,"Please note that the secret is not (only) about heating. It is (also) about wrongly using everclear with so much proof (190!) for so much time (one week!). Doses are: zest 40 grams, 190 proof 80, water 120, sugar 50. Extraction: four days only.",2018-12-06 16:44:46.943,8185,
5859,3311,0,Coopers pale ale..fermented in the bottle. Best after date on lable as opposed to best before date. Does this help?,2018-12-08 12:56:16.283,8272,
5862,6679,0,Great find! Have you seen this item (or similar) for sale outside Israel?,2018-12-09 05:41:43.06,7965,
5864,7591,1,I've occasionally found wine that sat in a cup overnight and I can confirm -- *blech*.,2018-12-11 21:44:20.647,43,
5865,3311,0,"Can you be more specific about ""opened""?  Just sitting there in open bottles?  Opened but with a stopper or grolsch plug?  Something else?",2018-12-11 21:45:44.49,43,
5866,7593,0,"Thanks, this is a great answer!  I live in Florida and cannot wait to go to a bar this weekend and order a Git-Right!",2018-12-13 20:41:03.623,8165,
5867,7602,0,"No weird, as red wine should be served at ""cellar temperature"" which is cooler than you think.",2018-12-15 15:43:51.917,6370,
5869,7600,0,Please edit the question to remove the last sentence since that is asked in another question.,2018-12-15 15:46:28.707,6370,
5870,7602,0,"I don't feel this is a duplicate. The question isn't asking what the recommended serving temperatures are, but whether it is odd that they might prefer them served at a different temperature.",2018-12-15 17:34:45.213,4725,
5871,7603,0,Truthfully this is a bit of a rant. The entire second paragraph is unrelated to the question (in my humble opinion). Please note I'm not disagreeing with your comments.,2018-12-15 17:48:04.23,6370,
5872,7603,0,"I don't disagree that the second paragraph is a little bit of a rant, but in my opinion it is a rant that goes to the question asked; it addresses the feeling that one is doing wine the ""wrong way"", whereas I point out that a good deal of the norms and, yes, I'll say ""snobbery"", is [built on a house of cards](https://www.thebillfold.com/2016/09/confessions-of-a-former-wine-snob/) to begin with.  If I wanted to make it a full-blown rant, I would have mentioned the whole [cork vs. screw cap](https://winefolly.com/tutorial/corks-vs-screw-caps/) issue.  :)",2018-12-15 18:01:45.87,4725,
5873,7603,0,"The question was closed since it is a duplicate anyway. However, the simple answer to whether his preferring his red wine slightly chilled is that is normal normal because the recommended temperature of ""cellar temperature"" is somewhat cooler than typical room temperatures. It is okay to add the comment that it is perfectly fine to drink your wine at any temperature you like it. I think a lot of people drink white wine too cold, but I don't argue about it.",2018-12-15 20:02:20.423,6370,
5874,7602,0,@Dave The linked accepted answer clearly states that the recommended serving temperature is cooler than room temperature which answers this question.,2018-12-15 23:10:09.37,6370,
5875,7605,0,"Thank you. When new EU members joined EU what kind of obligations they have accepted about ""Isabella"" wines? I am asking because Isabella mostly gone in those two decades in Balcans region. Even if it is sold with this name it is a different kind of wine. 
So I'm interesting is it a result of burocracy regulation or taste migration?",2018-12-16 13:48:29.483,8285,
5876,7605,1,"I don't know the exact laws, but there is some protection from having to rip out all grapes descended from American heritage in new member countries and probably an ability to protect them if they can justify some special reason. Remember, this is not for your average wine, this is for DOC or AOC or whatever controlling body wants to control an appellation. Switzerland has quite a bit of hybrid.",2018-12-16 14:53:54.187,6111,
5877,7606,0,Thank you very much. Get a number of keywords to study. Us I understand Acetic Acid is present in every brewing process (at least of berry wine brewing) since there are a lot of tests in the shop to control it.,2018-12-17 16:03:08.98,8285,
5878,7606,0,"and of course which books you could recommend (for berry wines, ciders, fox grape)?",2018-12-17 18:21:03.883,8285,
5879,7606,0,Here is one I used when I got started. https://www.amazon.com/Techniques-Home-Winemaking-Comprehensive-Château-Style/dp/1550652362,2018-12-17 20:09:59.12,6111,
5880,7605,1,+++++1 Wow .... @KenGraham how do we elect you and FarmerSteve as mods on this site?,2018-12-19 15:19:21.63,6391,
5881,7437,0,"I am voting to close this since we will never know unless the person in question goes to an allergist. Most beer is barley, hops, water and yeast. If you can drink one type of beer and not another, it might be a reaction to a particular yeast strain, but highly unlikely. There are adjuncts like corn, rice, wheat, etc. It could be a reaction to one of those. Since this person can drink wine and other drinks without a problem, it's very hard to pin down the issue.",2018-12-20 18:45:23.433,6111,
5882,7604,0,Contrasting with Sancerre and Pouilly-Fume would be informative since Bordeaux sauvignon blanc is often blended with semillon,2018-12-22 00:03:02.85,6370,
5883,7597,0,"You might want to check out this stack: https://homebrew.stackexchange.com/

Lots of really smart/experienced people there!",2018-12-22 00:55:32.187,8155,
5884,7609,0,"Are ""red beers"" particularly high in gluten? If not, it would seem unlikely this is the problem. Especially since someone with celiac would have problems with lots of food products. I have a friend with celiac and she needs to be extremely disciplined in her food choices.",2018-12-22 14:26:23.29,6370,
5888,4945,0,Is that a thing (scotch and ginger-ale)?,2018-12-28 03:20:51.853,7965,
5889,7614,3,"I think there is a distinction between distilling and aging. Distilling methods like pot or column stills may impact taste, but are independent from aging methods which use wooden barrels. I believe Bourbon ages faster than Scotch mostly because it does so at a higher average temperature.",2019-01-01 15:49:28.07,6370,
5890,7615,1,According to my brother-in-law he's using some type of special barrel that speeds up the process independent of surface area. Sounds like in his case it can also be a matter of the material you use.,2019-01-02 17:19:46.1,938,
5891,7615,2,"They use barrels with grooves in the staves to increase surface area or oak spirals. Many new distilleries will use small casks to ""speed up"" the aging process to get something on on the market sooner, but it's way more expensive.",2019-01-02 17:45:22.22,6111,
5892,7615,3,"Smaller barrels and higher temperatures also cause greater losses to the angel's share. Its also worth noting that aging is a pretty complicated process made up of many different chemical reactions that are likely affected differently by temperature, wood contact and oxygen entering through the barrel, so faster aging would produce different results that slower aging.",2019-01-02 23:12:13.837,5619,
5893,7615,0,So it sounds like it might be theoretically possible but the answer is closer to no,2019-01-04 01:04:18.76,938,
5896,7619,2,"Freezing wine isn't a bad idea in some cases, according to Wine Spectator.  (And other sources, this is just the first one I found online.) [If I freeze rosé wine, can I drink it when it’s defrosted?](https://www.winespectator.com/drvinny/show/id/49698) and [Feedback on freezing wine](https://www.winespectator.com/drvinny/show/id/49730)",2019-01-08 20:10:04.703,37,
5897,7622,2,"Agree with all of this, and a fourth reason would be the time it takes to brew (several months IIRC) tying up people and equipment.",2019-01-09 14:13:08.893,37,
5898,7622,1,"You are right, I was going to edit my answer in order to expand point 1) to production costs (raw material + production time), but you arrived first.",2019-01-09 14:20:54.883,8185,
5899,7622,0,"By all means, still feel free to edit it into the answer!",2019-01-09 14:35:35.17,37,
5900,7622,0,#2 is wrong up to a point. In some states beer is beer and taxed the same no matter what and others when it goes above a certain ABV it kicks into another class of taxes.,2019-01-09 15:11:30.083,6111,
5901,7622,1,"#2 seems to depend on jurisdiction, unless you mean that Dogfish has to pay higher taxes where they produce it.  As for additions, please do [edit] to expand; we want the information to be in the post, not buried in comments.  Thanks.",2019-01-10 02:07:10.167,43,
5902,7615,1,"@CanadianCoder I would say it more-so depends on how you're evaluating it.  Are you able to create ""12 year"" whiskey in less than 2 years?  Yes.  Is it exactly the same as whiskey that has been aged for the full 12 years in standard barrels?  No.  Is it good enough for your purposes?  Depends on your values, time, money, etc.",2019-01-10 20:38:03.933,4935,
5903,7623,1,"Where are you seeing this?  On a bottle label, in a catalog somewhere, someplace else?  (Knowing whether the label comes from the vineyard or a third party could help.)  Thanks.",2019-01-13 02:14:47.36,43,
5906,7622,1,It also has a higher rate of failure to brew (increasing cost). I watched a documentary (https://en.wikipedia.org/wiki/Brew_Masters) featuring the owner of Dogfish Head and sadly watched them dump a  whole fermenting tank because something when wrong and recall them discussing the high rate of failure and that is why they have a hard time making enough to keep it as a regularly stocked beer (I can't recall the last time I saw it even in specialty stores).,2019-01-14 16:10:13.36,5027,
5908,7622,0,"My guess is that 3) Marketing is the dominant reason. Make a special product, don't make much of it and price it high.",2019-01-19 23:45:19.187,6370,
5909,7623,1,I suppose it would be a catalog; it came from a stock list a distributor sent me. It's not clear if the winery labelled it like that or if the distributor did.,2019-01-21 15:52:08.46,8340,
5910,7624,0,"I think this is most likely the correct answer. I know the winery (Domaine du Mourchon) only ships to a few places here, so I think all of their wines are technically ""ex-domaine"" since they go directly to retailers.",2019-01-21 15:52:57.753,8340,
5911,7626,0,"Hi Simon, please expand your answer to explain what it is about this service that makes you prefer it.",2019-01-23 13:54:20.257,37,
5912,6425,0,"@Neil Meyer  Yes. Technically speaking for now - Jan 2019 - there are two in the Netherlands --- and zero in France (yet, as French beers are produced by another monastery - Chimay in Belgium) . But some more in the US, UK, Austria, and Italy",2019-01-23 16:52:15.617,8185,
5915,7633,0,Everyone is welcome to add to this Community Wiki post for the betterment of all.,2019-01-24 14:27:52.91,5064,
5917,7631,0,"""..but for a distillery the profit margins would not be high. The Angel's Share loss is high - I wouldn't want to agree mine for 12 years.."". Not getting your meaning here. Why are profit margins low, and Angel's Share loss high?",2019-01-31 20:19:08.277,938,
5918,7631,2,"Smaller cask, greater surface area, higher Angel's Share, higher cost.",2019-02-01 03:14:23.65,187,
5920,6789,0,"Has anyone else experienced this or am I just an aberration? I tried Kava. I bought what the lady told me was the most potent/kick ass extract in existence. I took a double dose - nothing. I tried doubling and tripling the dose - still nothing. I had high hopes for the stuff, but it doesn't seem to have any effect on me whatsoever.",2019-02-02 01:22:08.24,8393,
5928,843,0,I assume you are referring to the original standard Beck's German Pilsner and not Beck's Premier Light Lager?,2019-02-10 06:07:33.227,1454,
5931,7638,0,The main reason for this change is that more people prefer the sweeter or hoppy ales. They sell more so brewers make more. The good thing is that there are still plenty of bitters - they are a large minority.,2019-02-12 10:33:32.513,187,
5932,7640,1,"As far as I understand and have experienced the American version, it basically amounts to a meaningless meme and joke. The reason could be as simple as liquor rhyming with sicker.",2019-02-12 21:16:50.59,938,
5933,4749,0,"im a 58 yr old and live in seattle. can only drink german bier, coors light and micros from breweries away from the PNW. California and colorado. I thought it was the nw hops but maybe barley or roundup?",2019-02-13 02:13:26.393,8409,
5935,4816,0,"Hi Pole, this question doesn't look like a good fit for the Stack Exchange community as it is too broad. Questions should have a single, specific, and unambiguous answer.",2019-02-20 19:55:45.397,938,
5936,7414,1,Some beers don’t age well. IPAs in particular are best fresh. Even a month or two old they’ll be less tasty.,2019-02-26 23:28:25.13,6370,
5937,7414,0,"The question is ""was it safe to drink?"" and the answer is always yes. Does it taste good is another question.",2019-02-27 14:52:37.107,6111,
5938,7414,3,"I understand that. Your answer suggests that most beers are improved with aging. Unlike red wine, most beers are better fresh. Safe either way.",2019-02-27 15:06:35.607,6370,
