id,postid,score,text,creationdate,userid,jsonfield
1,5,0,This is a matter of taste I guess.,2014-01-21 20:34:28.74,10,
4,16,4,This question appears to be off-topic because it is about biology rather than beer.,2014-01-21 20:52:14.49,39,
5,16,8,"Obviously, you should pee into the empty beer bottles to check this theory.",2014-01-21 20:55:44.723,41,
6,5,3,Doesn't this depend on the type of beer as well?,2014-01-21 20:57:44.653,43,
7,19,4,I retracted my close vote after reading this answer.  Well done.,2014-01-21 20:57:47.373,20,
8,26,10,A good answer here should include *how* various types of glasses work.,2014-01-21 20:59:55.223,39,
9,22,0,"I feel like this is probably too broad, there are no less than a dozen different types of beer glasses and each of them is intended for a different type of beer. Questions should be more specific.",2014-01-21 21:00:40.79,39,
10,22,0,"You could probably also ask ""what"", if there are any, the right kind of glass for each beer would be.",2014-01-21 21:00:42.203,25,
11,26,2,"I don't think there has really been a scientific study on the beer glass shapes etc.  HOwever there have beeen some on wine http://www.aromadictionary.com/articles/wineglass_article.html  

Which basically said the shape of a glass can affect the aroma but many shapes can have the same impact.  The major factor in aroma enhancement was the ratio of glass cup diameter to the diamter of it's opening.

Check out the last study on the linked page for more info.",2014-01-21 21:02:13.803,28,
12,39,2,You might also be interested in our [homebrewing site's response to a similar question](http://homebrew.stackexchange.com/questions/949/what-does-imperial-mean-with-regards-to-beer-style).,2014-01-21 21:05:40.863,2,
14,5,0,"@MonicaCellio Well yes, that's what I'm asking.",2014-01-21 21:06:31.85,7,
15,45,1,"Yeah, I said 'equivalent quantities of alcohol', implying if you drink something with twice the ABV, you drink half as much.",2014-01-21 21:10:29.653,7,
16,29,2,"I can't believe I have the ignominious honor of asking the first dupe here.  In my (meager) defense, the dupe wasn't there when I stared the question.  <sigh>",2014-01-21 21:11:24.477,38,
18,45,0,"didn't see that before, my bad.",2014-01-21 21:14:47.347,31,
20,16,1,I really hope you're not actually peeing beer.,2014-01-21 21:15:32.32,7,
22,50,10,"I don't know enough to answer, but will add this observation:  The old legend that ""Cold, Warm, Cold Again"" skunks beer CAN'T be true:  Coors is ""Shipped Cold from the Rockies,"" or some such nonsense, but you can buy it warm in the store.  And in numerous observations, I've found that making it cold again makes it no more gross than it always is.",2014-01-21 21:19:10.987,38,
23,5,0,@TomMedley I think what Monica is getting at is that it should be a specific question for a specific beer. This is too broad.,2014-01-21 21:23:35.237,39,
24,16,2,"@waxeagle, I'd put this squarely in the middle of the beer/biology interest diagram. Assuming we have sufficient expertise to answer it here, it's relevance to the beer-drinking audience makes me think it's on-topic.",2014-01-21 21:24:38.367,38,
25,5,0,"@waxeagle Asking for every beer would be a lot of questions. I'm asking for a rough guide, and the answer provided is an excellent one.",2014-01-21 21:24:48.353,7,
26,49,4,I think the question was why drinking beer *after* wine is a bad idea.,2014-01-21 21:24:54.43,52,
27,64,1,Isn't it nitrogen in the widget?,2014-01-21 21:25:53.17,57,
30,64,1,"It does indeed, good catch!",2014-01-21 21:28:36.137,53,
31,64,1,"Since the jury is still out on which is ""greener"", go with whatever is more easily recycled in your area! Taste be damned!",2014-01-21 21:28:57.32,50,
32,72,1,Red Brick also has excellent things to say about Atlanta's water supply :),2014-01-21 21:32:12.77,39,
33,77,0,I've heard that drinking beer lowers sexual desire. Maybe it's BPA-reletad. But it's a good topic for separate question.,2014-01-21 21:37:51.653,21,
34,71,9,"Do you have any links that back up your claim that CO2 causes alcohol to go to your head faster? Also, you may want to consider removing your last paragraph; you're giving advice that's based solely on opinion, and it's irrelevant to the question. (And also wrong: when I go out, I often have a pre-dinner drink with a strong alcohol, then switch to beer or wine later in the evening, with no ill effects or regret.)",2014-01-21 21:38:15.49,47,
35,80,3,What *is it* though?,2014-01-21 21:38:18.577,39,
36,76,0,This varies wildly on the type of beer being poured,2014-01-21 21:39:40.007,7,
37,77,0,It probably does...but it's too good to give up. Best for a separate topic.,2014-01-21 21:41:05.92,31,
38,71,0,"@Laura well no, it's just what are people saying. At least in Poland. And they are referencing their own experience. I've modified the question to stress out it's only said it's so.",2014-01-21 21:42:24.937,21,
39,81,5,This question appears to be off-topic because it seems to belong on skeptics (if the claim is notable),2014-01-21 21:44:50.553,39,
40,71,4,"I'm not sure about not drinking lighter (weaker) alcoholic drinks after stronger ones. I've always thought the opposite: bad things happen if you have a few beers and then start drinking something strong like whiskey or vodka, because it's very easy to drink too much of the stronger liquor since you're already a bit inebriated.",2014-01-21 21:46:51.027,68,
41,81,0,"@waxeagle well, it could be. I have a bit of links, unfortunatelly all in Polish.",2014-01-21 21:47:00.437,21,
42,88,2,How long does it take? Days? Weeks? Months?,2014-01-21 21:48:12.377,7,
43,78,2,"According to Sam Adams's tour in Boston, their primary breweries (which aren't in Boston) actually put the local water through a special process to make it match Boston water before it's used in brewing.",2014-01-21 21:48:47.743,66,
44,86,2,"I would suggest reading [the Wikipedia article](http://en.wikipedia.org/wiki/History_of_beer). Your answer is going to depend on what you define as a brewery, and how much information you need. Does it need a name, or is it enough to know that there are recordings of beer brewing in Ebla, Syria in 2500 BCE?",2014-01-21 21:49:50.387,68,
48,67,0,Sounds like the context of this answer is [Homebrew.SE].,2014-01-21 22:02:03.217,17,
49,96,2,"You, sir, have never been to the great state of Oklahoma! :)",2014-01-21 22:02:10.013,20,
50,76,0,@TomMedley I made it specific to stouts. Is it answerable now?,2014-01-21 22:02:33.06,36,
51,76,0,"Yes, but Guinness is a special case.",2014-01-21 22:03:22.703,7,
52,15,1,If you drink the bottled beer actually from the bottle you won't get any of the aroma.,2014-01-21 22:04:21.677,7,
53,2,0,"[Ancient Mesopotamia](http://en.wikipedia.org/wiki/History_of_beer#History), as a starting point.",2014-01-21 22:08:10.87,43,
54,47,0,"I closed this as a duplicate of a slightly more open-ended question.  From the answer you got, it sounds like ABV is just one factor that determines how well a beer ages.",2014-01-21 22:10:32.203,17,
55,74,1,http://beer.stackexchange.com/questions/3/how-is-reduced-alcoholic-beer-made addresses how it is achieved.,2014-01-21 22:13:51.38,5,
56,16,0,[The topicality of this question is being discussed on meta](http://meta.alcohol.stackexchange.com/questions/3/how-much-do-we-want-to-get-into-biology).,2014-01-21 22:22:28.513,13,
57,7,0,[The topicality of this question is being discussed on meta](http://meta.beer.stackexchange.com/questions/3/how-much-do-we-want-to-get-into-biology).,2014-01-21 22:22:38.547,13,
58,103,1,This doesn't really answer the question at all.,2014-01-21 22:23:48.497,8,
59,27,2,"Yes, the word is nitrogenate.",2014-01-21 22:25:50.977,8,
60,103,0,"I edited my answer to try to respond to the question a bit more. But I think I am answering the question, just perhaps more pragmatically than you would like. The long and short is I don't know what qualities make a beer suitable for cellaring, so I don't cellar any beers unless the brewer has specifically told me to. And if they want you to, they will. And if they don't, it's probably because their beer will not improve with age. I think only some very special beers do.",2014-01-21 22:38:22.943,68,
61,76,1,"With Guinness, if you can see a clover on top, then you know you've got it right.",2014-01-21 22:48:34.59,68,
62,103,0,"To my knowledge, most modern wines don't age.  Champaign may because it is bottle fermented.  When looking at an old bottle of wine, the more important fact is what year it was bottled and how the other bottles from those grapes did.",2014-01-21 22:50:15.173,5,
64,117,0,"Unless you want it to overflow the glass so you can scrape it off with one of those beer-scraper-offer things. I usually go for 2 cm to 2.5 cm of head (foam), which is about one thumb width for me.",2014-01-21 22:52:44.33,68,
65,117,1,[Notable exception.](http://youtu.be/yNCaV3e9BEg),2014-01-21 22:54:35.027,8,
66,76,1,Non-answer: none of the beer landed on the table or down your shirt.,2014-01-21 22:56:22.287,27,
67,112,1,"Good answer. What I'm not clear about is with lambics or other beers where yeast is added at bottling, is that bottle fermentation simply for carbonation or does it actually change the flavour significantly?",2014-01-21 22:56:46.863,68,
68,32,0,"This raises the importance of staying properly hydrated while drinking alcohol; the beer more you drink, the more dehydrated you're going to get.",2014-01-21 22:58:32.473,85,
69,103,0,"Wikipedia says [some kinds](http://en.wikipedia.org/wiki/Aging_of_wine#Good_aging_potential) of wine can age well, but I've never tried so you might be right.",2014-01-21 22:58:59.61,68,
70,112,1,"It is not just for carbonation, flavors do change.",2014-01-21 22:59:28.613,27,
71,122,0,Depends on how cold it was to begin with.,2014-01-21 23:00:50.423,85,
72,122,0,Oppssss. Question edited to add that derail.,2014-01-21 23:04:01.433,81,
73,124,0,A good answer to this question will be a *lot* longer.,2014-01-21 23:04:13.213,86,
74,103,1,"Brian, I fear we are going off on a tangent, but its somewhat tricky to say that wines ""don't age"".  It's true that today, as 100 years ago, most wines are drank more or less as soon as they are released.  However, as 100 years ago, there are still plenty of modern wines that can, or _should_, be left to sit for 2 years, 5 years, 10 years, or longer.  It is the uncommon wine that will age a ""long"" time, but it has nothing to do with whether a wine is bottle fermented.",2014-01-21 23:08:18.627,27,
75,124,0,"True, which is why I just upvoted phoebus'.",2014-01-21 23:09:37.837,27,
76,123,0,"CO2 is definitely the norm, since it occurs naturally during fermentation. I'm not sure if I've ever had a nitro beer. Here's an [interesting article](http://www.craftbeer.com/craft-beer-muses/good-beer-gas-nitro-beers-explained) on the difference.",2014-01-21 23:12:31.443,68,
77,123,1,possible duplicate of [Why does a nitro beer taste different?](http://beer.stackexchange.com/questions/118/why-does-a-nitro-beer-taste-different),2014-01-21 23:16:07.523,8,
78,122,1,"Sounds like a physics question to me. There are a lot of variables including starting volume, how fast you drink, atmospheric pressure, shape and type of container, [whether the beer is stirred](http://physics.stackexchange.com/questions/5265/cooling-a-cup-of-coffee-with-help-of-a-spoon), etc. and so on.  For me, I can keep drinking the same beer for as long as the poker game lasts. ;-)",2014-01-21 23:21:21.42,17,
79,107,0,I had wondered whether the excessive hops in IPAs could cause (worse) hangovers.,2014-01-21 23:26:40.777,20,
80,93,0,"Does it matter how the fish is prepared? For example, the fish cooked in beer/ale that I've seen tended to be deep fried. If the fish is grilled or baked (and perhaps seasoned), would an ale or amber still be appropriate or may there be a better option?",2014-01-21 23:26:43.937,79,
81,93,0,"@ThomasOwens good point.  When I think of tilapia and similar fishes I think of poached, baked, or grilled, not deep-fried (which I don't have a lot of experience with -- I don't deep-fry at home, and when out the beer options may be limited or non-existent).",2014-01-21 23:29:03.837,43,
82,132,0,I don't think that you're on the right track here.  You can have a pale ale or pilsner that's just as light as a lager; it's not ale vs. lager yeast.  IPAs DO have a considerable amount of hops -- that's what makes them IPAs.  Hefeweizen does NOT necessarily have a significant amount of yeast left over; that cloudiness is not yeast related.,2014-01-21 23:34:06.007,27,
83,132,0,"If you ever have a chance to try Alexander Keith's IPA, please do. It's not a very good beer, but it is an example of an IPA that I don't think is hoppy (many of my friends who don't like most IPAs do like it). Are you sure about Hefeweizen? [Wikipedia begs to differ](http://en.wikipedia.org/wiki/Hefeweizen#Weissbier).",2014-01-21 23:39:42.44,68,
84,125,0,"There's two different kinds of categories - aroma, flavor and mouthfeel, and to some extent appearance, are subjective. Ingredients are objective. I'd argue that the 'true source of variation' in the subjective factors is the ingredients. The brewing process certainly contributes, but the ingredients determine almost all of the other characteristics. E.g. if you use roasted barley and belgian yeast, you're going to get a dark belgian beer, regardless of process, although process will influence the subjective variables.",2014-01-21 23:42:02.717,94,
86,119,2,FYI: We also have a site dedicated to [Homebrew.SE].,2014-01-21 23:44:13.333,17,
87,132,0,"First off, a Pilsner is a lager. And that's why I was trying to be careful with my wording, and say things like ""on average"", since you're absolutely right, they can often be just as light or as dark. But I would argue that your typical lager is lighter (specifically flavour-wise) than your typical ale, and I've never had a lager that is as heavy as something like an imperial stout.",2014-01-21 23:45:09.013,68,
130,136,1,"Some are pushing the name ""Cascadian Dark Ale"" for the Black IPA as well.",2014-01-22 06:26:54.003,8,
131,120,0,"""naturally"" == without adding alcohol :)",2014-01-22 06:37:19,21,
132,161,0,"""This being said, I don't condone a general pursuit of drunkenness...."" - Yeah I've tagged it as inebriation, but what I really mean, is just the general effect the beer has.",2014-01-22 06:42:04.157,87,
439,381,0,@mdma - I agree. (VTC'ed my own question for the same reason.),2014-01-29 20:00:45.927,73,
88,132,0,"These distinctions are definitely based more on ingredients than brewing process. Wheat beers have a lot of wheat, IPAs have a lot of hops (relative to other styles), stouts have roasted barley, etc. Alexander Keiths IPA is an ENGLISH IPA. English IPAs are very different from American IPAs and are not hoppy at all relative to American IPAs. They are however, supposed to be more bitter (hoppy) than English Pale Ales. American IPAs are a totally different style, and judging English IPAs on that standard is like judging a Scottish Heavy to be bad if it doesn't taste like a lager.",2014-01-21 23:45:55.92,94,
89,132,0,"Fair enough, @paul. I was just using Alexander Keiths as an example of what I consider a very ""mainstream"" IPA, not tasting much hoppier to me than a Pilsner. I don't think it's bad because it's an English IPA, I'm just not a big fan of that particular beer. As to brewing process versus ingredients, you're right, a lot of it is ingredients more than process. But lagers versus ales is definitely a brewing process decision, which is why I started out with that.",2014-01-21 23:51:49.97,68,
90,55,5,Is this the first [freehand circle](http://meta.stackexchange.com/a/19775/188984) on this site?,2014-01-21 23:59:36.237,73,
91,74,1,"I thought you were referring to ""non-alcoholic"" beers, like non-alcoholic Beck's—which, by the way, still have a fraction of a percentage of alcohol. I can assure you that these taste _nothing_ like beer—more like old cough medicine.",2014-01-22 00:04:13.913,73,
92,15,0,"@TomMedley for sure, but it's still less quality even if you pour it.",2014-01-22 00:05:47.19,25,
94,125,0,"@paul One could argue that barley is the ingredient (including what type, where it was grown, etc.), and roasting the barley is part of the brewing process (including how exactly it was roasted, duration, etc.).",2014-01-22 00:10:05.213,68,
95,74,0,@acheong87 - interesting.  I've never had non-alcoholic beer.  I was just wondering about the 3.2 crap some states make grocery stores sell.,2014-01-22 00:16:38.55,20,
96,132,0,"Ah, you are right about Pilsners being lagers, that's my mistake.",2014-01-22 00:19:36.187,27,
97,119,1,This question appears to be off-topic because it is about homebrewing. Homebrew questions should be directed to [homebrew.se],2014-01-22 00:20:16.983,39,
98,119,0,"Silly me, i have mistakenly posted on this page instead of Homebrewing. Is there a way to move this post?",2014-01-22 00:25:32.473,77,
99,26,0,I tried to add a little more info about the glassware; hope this helps.,2014-01-22 00:27:24.723,27,
100,135,3,"Where does 60% come from?  I've never heard that specification before.  Is that just with adjuncts or all fermentables (e.g., honey)?",2014-01-22 00:32:18.257,5,
101,135,0,"May be I must make it clear. That knowledge is from a local expert of a big brand in my country. Probably it may be changed. You are right, it is better to make it clear.",2014-01-22 00:39:47.05,81,
102,119,0,"@JavaCake: Since we are still in private beta, no.  But if and when the site goes public, we can.  In the meantime, you can either wait or re-ask over on that site.",2014-01-22 00:42:32.8,17,
103,123,0,"merged with the duplicate question, so this is the only way I can clear the close votes.",2014-01-22 01:30:55.427,60,
107,141,0,"Here in New Zealand I've only seen it served with lemon, not that I drink a lot of Corona.",2014-01-22 02:56:32.96,87,
108,141,2,Or is there something _missing_ from Corona that makes it require the addition of a lime?,2014-01-22 03:02:10.67,50,
110,129,0,This is likely an issue with state legislation and how they are typically licensed. There should probably be a meta discussion about how much legal stuff we want to be on topic for this site.,2014-01-22 03:45:50.98,39,
113,143,0,"I'm okay without a lime in my Corona, but I was very surprised how much better Land Shark is with lime.",2014-01-22 04:14:45.71,113,
115,150,0,In which case - why don't more beers smell like cannabis?,2014-01-22 04:44:50.563,87,
116,125,0,"Ok, technically, yes you could call malting and roasting the barley part of the brewing process. I was more referring to what the brewer actually does as brewing, and commercial and home brewer's rarely if ever roast their own barley. They buy it that way from the malt supplier (Briess, Weyermann, Rahr, Cargill, etc.)",2014-01-22 04:46:10.37,94,
117,137,1,"I'd go for a pilsner, or perhaps a pale ale for fish and chips, because you want something easy drinking to wash the grease down with.",2014-01-22 04:50:38.797,87,
118,150,2,"Because most of the aroma is stripped out in the brewing process, unless it's actively pushed back in through dry hopping.",2014-01-22 04:51:40.34,8,
119,132,0,"Ok, the issue is really that there are generally accepted to be two kinds of IPA - American vs. English - and they are very different styles, and you wouldn't compare the two. Many English IPAs are not very hoppy tasting, and there are hoppier pilsners. Ales vs lagers is not just a brewing process decision though, temperature (lagering) is certainly part of the process, but ales use ale yeast strains to ferment warmer and lagers use lager least strains to ferment colder, and yeast is an ingredient.",2014-01-22 04:53:14.77,94,
120,130,0,"You can also dry hop things other than beer to try and increase taste/aroma. Orange peels (don't leave the white stuff on), cinnamon, vanilla bean, etc. Also, to make clean up easier, use a fresh cheese cloth or something that you can easily wrangle your additives.",2014-01-22 05:11:05.78,22,
121,130,0,"When the beta acids oxidize in hops they become bitter, so you can get a bitterness from dry hops addition.",2014-01-22 05:32:48.66,112,
122,156,1,actually the plants are close enough that one can be grafted onto the other.,2014-01-22 05:45:35.967,117,
123,143,1,"btw, different citrus fruit go well in different beers.  This can be fun to experiment with.  Some richer orange-type fruit go well with Guiness, for example, and I like calamondin in pilsner.",2014-01-22 05:51:21.95,117,
124,122,0,"Agreed that this is a bad question.  There are huge numbers of variables and one missing one is what kind of beer it is.  Some beers are better to drink warm and especially if you go with some specialty beers, some may not be carbonated to begin with (and therefore don't go flat).  This can't be answered other than ""it depends.""",2014-01-22 05:54:17.95,117,
125,119,0,"Just for the record, my answer (as one who has been homebrewing for almost 2 decades) is the best practice is not to.  Sterilize your bottles and equipment.  Once you start pasteurizing, you are going to have lots of extra stuff you have to do and there are risks of having all kinds of additional things going wrong.",2014-01-22 05:57:13.743,117,
127,111,0,"although never-carbonated beer (once the standard) doesn't have this problem and has a flavor very, very different from flat beer.",2014-01-22 06:17:20.923,117,
128,71,0,"@Laura, here's a link I found quickly from NIH in the US, which backs up the assertion though not with a link to research.  http://www.nlm.nih.gov/medlineplus/ency/article/001944.htm",2014-01-22 06:22:01.383,117,
129,71,0,That carbonation increases alcohol absorption seems to be pretty common knowledge though.,2014-01-22 06:22:34.213,117,
133,81,1,"@waxeagle — but, [as with Homebrewing questions](http://meta.beer.stackexchange.com/questions/4/what-should-we-do-when-a-question-already-has-an-answer-on-the-homebrewing-site), this might simply be a question with overlapping audiences. The question is certainly about beer, and it's an important question I've frequently heard asked by athletes and health-conscious people in general. Any definitive answer to this question (although I suspect there is none) would certainly affect my consumption / enjoyment of beer. I think it's a good question, and not only because I answered it.",2014-01-22 08:00:08.16,73,
134,131,1,"It's worth noting that traditionally, most beer was not sold carbonated, and that which was, was partially bottle fermented (like champagne).  This is why CO2 is predominatly used.",2014-01-22 09:15:13.247,117,
135,170,2,That little plastic thing that makes the beer explode out of the can? :),2014-01-22 09:19:29.34,130,
136,86,2,"Brewing beers predates existence of breweries by a significant margin, therefore closing this basing on assumption ""first recognized brewery""=""first time beer was made"" is horribly flawed.",2014-01-22 09:43:24.423,130,
138,41,1,Etymologies are best when hotly debated. ;-),2014-01-22 10:29:52.917,117,
139,71,0,I think the big issue is the carbonation.  Drink wiskey and beer in any order and that's going to be an issue.  I am not at all sure that the order of strength matters.,2014-01-22 11:06:20.77,117,
140,2,0,"@MonicaCellio, I think it almost certainly goes much further back than that given the prevalence of different starch-to-sugar fermentation techniques around the world.  There's no way that South American, North American, Chinese, or Japanese brewing traditions could have developed from the Mesopotamian approaches.",2014-01-22 11:30:01.583,117,
141,15,1,"Might it be subjective / a false impression? For example, for whatever reason, I've always noticed that Stella tastes better (poured) out of the bottle than on draught. In the U.S. at least.",2014-01-22 12:02:01.08,73,
142,179,1,"To add to your list of additives, I've also seen citrus (normally lime or lemon) and even other spirits like tequila or vodka, although these seem to usually be added post-brew as a gimmick.",2014-01-22 12:41:37.603,85,
143,179,0,Citrus would probably be quite good.  I havent tried it or seen it.  Good catch though.,2014-01-22 13:06:40.003,117,
144,60,0,"Well, there's always the infinitesimal chance of contracting [Auto-Brewery Syndrome.](http://www.npr.org/blogs/thesalt/2013/09/17/223345977/auto-brewery-syndrome-apparently-you-can-make-beer-in-your-gut) But personally, I'd hesitate to call that a *problem* strictly speaking.",2014-01-22 13:18:36.61,8,
145,101,0,"I actually disagree with you for the corked bottles, see my answer :)",2014-01-22 13:36:15.15,138,
146,191,1,did you just answer your own question?^^,2014-01-22 13:48:54.043,141,
147,191,1,"Yea, it's to get some questions and answers going for the beta site :p",2014-01-22 13:50:58.56,138,
148,2,1,"@ChrisTravers, yes, I left out an ""at least"" there.  My instincts match yours, but that's the documentation that was readily to hand.",2014-01-22 13:57:52.45,43,
149,194,0,"Mmm...I was looking for more along the lines of HOW it can be changed, not just an assertion that it WILL change.",2014-01-22 13:58:07.16,116,
150,191,1,"Remember, light can drastically affect beer. Darker bottles can withstand more light than their green and clear counterparts. However, light is not good for beer in general, even if it is stored at the appropriate temperature.",2014-01-22 13:58:29.047,22,
151,194,0,Ah. sorry to not answer your question appropriately. Let me try again.,2014-01-22 13:59:14.253,22,
152,191,0,@Grohlier edited in your comment,2014-01-22 14:02:17.177,138,
