id,postid,score,text,creationdate,userid,jsonfield
4411,6515,0,"I added a bit more content, but really I think it is a reasonable answer that hasn't been covered by the other answers to this question.",2017-02-08 15:28:44.703,6370,
4412,6514,1,What about cider and mead? Many find cider a good substitute to wine (especially dry cider) with the alcohol levels of beer.,2017-02-08 16:56:50.863,6111,
4413,6464,0,"@dougal - It's licorice-ish, I should have said. Not sure but, you may not like it. For perspective, I'm not a licorice guy but, I love the stuff. ;)",2017-02-09 16:19:28.773,5847,
4414,6503,0,@KenGraham Can you think of any other examples in Christianity that use wine OTHER than Catholic mass?,2017-02-10 02:59:32.07,6379,
4415,6503,0,@paqogomez The Orthodox Churches and the Lutheran Churches use wine liturgically. I am sure that there are others. My original comment came from the fact that Mormons consider themselves a Christian community and they do prohibit the use of alcohol.,2017-02-10 03:08:43.53,5064,
4416,6503,0,@paqogomez I... I don't know what you're referring to any more? I never mentioned Catholicism.,2017-02-10 03:12:41.873,22,
4417,6516,0,"wow - great info!  I was never really into Scotch before, this is an eye opener.",2017-02-10 05:58:55.247,6366,
4418,6513,0,"You'll have to taste it, but I suspect 25ml might be a bit too much.  I would start with 15ml.  Getting the sweet/sour ration correct is a matter of taste.  I recommend using dole pineapple juice if you can get it.   Good Pineapple juice should be sweet, but have a certain bite that creates a small numbing feeling on the tongue.  It not should not be mild but also should not taste or smell over-ripe.  Also, after re-reading your post I recommend you do NOT build the drink.  Instead, pour the ingredients into a shaker with ice.  Shake until it gets to cold to hold, then strain over fresh ice.",2017-02-12 01:06:26.667,5969,
4419,6513,0,"I see you said you don't have a shaker. Get one- they are <$5 US on Amazon. The procedure you use to make the cocktail is nearly as important as the ingredients.  Bartending/ Mixology, like any art or craft, requires proper tools; and in this case, a shaker is vital.  Mixing with Ice(until the metal shaker gets extremely cold), then straining over fresh ice is the best way to bind the ingredients together and allow for the beverage to stay cold longer with less dilution(at least in the first 15 minutes after preparing the drink).  Using the proper procedure is what separates good from amazing.",2017-02-12 01:48:23.81,5969,
4420,6514,0,"@Steve S.  Great Idea, however it's fermented, and there is the issue - I can't drink cider either - which is a shame as there are some great ciders out there - including a few that would knock my socks off!  I've been experimenting with the scotch and even tried a vodka or two, but vodka is still - well vodka...  at this rate I might have to become tea total!!",2017-02-12 04:42:14.02,6366,
4421,6517,0,"OK, not up on certain things, What are whiskey stones?",2017-02-12 12:52:30.48,6366,
4422,6489,0,I would have said what Steve S said.,2017-02-12 13:01:44.953,6366,
4423,6517,0,"@dougal2.0.0 they are stones in cubic shape, which you put in the freezer, then use as ice cubes.",2017-02-12 13:12:15.967,6386,
4424,6517,0,"Ah, that was what I thought!  Thanks for the info.",2017-02-12 13:13:21.05,6366,
4425,6521,0,"Ah ha, Wow, many thanks, this may sound a bit dumb, but I had put wine out of contender, but I will pass on your thoughts (they have to be done by text as my friend has no internet where she is).  One thing I have never tried is elk - but there is always time!",2017-02-12 13:47:48.643,6366,
4426,6520,0,@Ken Graham.  Sorry got distracted - I meant to thank you for your edits - thank you.,2017-02-12 14:23:40.18,6366,
4427,6518,0,Why don't you try to google? There is a good article even in Wikipedia about it.,2017-02-12 23:25:58.42,4742,
4428,6518,0,@AltbierisnotOldBeer Trying to stimulate the creation of good content here. 10 years ago when Wikipedia was young I wrote stuph there.,2017-02-12 23:35:07.903,1077,
4429,6521,0,"@dougal2.0.0 While I won't/don't do snake, and think Ken gave a great answer, I'd suggest that tequila shots with lime and salt might also do it: 
breathe out, lick the salt, down your tequila shot and bite the lime.",2017-02-13 01:03:19.647,6391,
4430,6523,0,again I stand amazed at what you know.,2017-02-13 04:15:04.513,6366,
4431,6504,0,Great article and again something I didn't know.,2017-02-13 05:06:19.05,6366,
4432,6520,0,"Having been suspended from seasoned advice for arguing with the mod over his edits, I don't know if the link will work...",2017-02-13 05:09:21.8,6366,
4433,6525,0,"Although this may be meant to be served cold, I think the question is asking if there is a whiskey that he can order at a bar or restaurant that will be reliably served cold with adding ice. This would probably mean the bottle is stored refrigerated. I don't know of one.",2017-02-13 15:13:37.043,6370,
4434,6520,0,"Although you may not be able to see it, the link works.",2017-02-13 16:03:09.68,6391,
4435,6521,1,@Dorothy Would you consider working your suggestion into an answer. It sounds good to me.,2017-02-13 16:12:04.2,5064,
4436,6520,0,"@Dorothy.  many thanks for that...  stil workng hard, so will get round to cheesecake very soon - oh boy oh boy oh boy.....",2017-02-13 16:33:39.05,6366,
4437,6526,0,The entree is for next month!,2017-02-13 17:22:43.11,6366,
4441,6529,0,"Great info - just a thought, your point about getting them 'over the finish line', sounds a bit like doping in sport!!",2017-02-14 05:51:36.603,6366,
4442,6530,0,"PS:  The prizes make it fun, and we have found some great wines at silly prices which we normally wouldn't have bought - the party works.",2017-02-14 06:01:54.8,6366,
4443,6525,0,"@EricShain Actually, if this whiskey is to be served cold, then the bar should keep it cold (as they do with the white wine). Otherwise, I can ask them to serve it properly (or maybe I never get to drink cold whiskey).",2017-02-14 09:59:34.95,6386,
4444,6525,0,Tell me if you find this particular whiskey at a bar served chilled.,2017-02-14 15:22:31.977,6370,
4445,6531,0,"Hi.  I live on a boat, normally for these tastings we have no more than 12 people, which of course means 12 bottles.  We have had so much fun, the prizes make it a great evening - only a couple of bucks a throw!",2017-02-14 16:23:28.997,6366,
4446,6531,0,We tend to tell people that the spittoon is over the side of the boat - but sailors being what they are.......!,2017-02-14 16:24:41.55,6366,
4447,485,0,"The importance of foam is has been discussed in a few other questions here: http://alcohol.stackexchange.com/questions/3414/what-is-the-significance-of-a-beers-head?noredirect=1&lq=1 and here: http://alcohol.stackexchange.com/questions/728/giving-beer-a-decent-head-and-why-people-like-it?noredirect=1&lq=1  But the ""proper"" amount is an interesting question and it'd be worth it to ask that as its own question or edit this to focus on that.",2017-02-14 17:01:31.343,268,
4448,6532,2,"To add to this - you will often see ""small batch"" on American labels for blended whiskeys. You most certainly can have different flavors from the same whiskey's with different amounts added to the ""small batch"" (see Four Roses Brent Elliot's special release). But... this is also the reason certain labels no longer have age statements. Elijah Craig, for example, had to start blending different ages of their flagship spirit because of the ""whiskey boom."" A lot of companies didn't plan to have such a boom 10, 12, or 23+ years ago.",2017-02-14 17:56:50.267,22,
4449,5037,0,"Thanks and Nice find Jamie, even later Acknowledgement by me, sorry for that. Sad news i don't drink anymore. Maybe a help for other people living in Pune.",2017-02-15 11:45:26.73,3917,
4450,6537,0,"Um, was it the milk?  When you say mixed with, do you mean literally 'mixed', or one whiskey, one milk.  I can't see why this would make anyone sick...  and believe me I have tried most combinations!  Quick edit: without the pictures, what do you mean by 'sick'?",2017-02-15 16:33:29.337,6366,
4451,6539,1,"I agree with this answer, pretty good stuff.",2017-02-15 16:37:51.983,6366,
4452,6539,0,Draught = Apples. I will say this to my brother! :P,2017-02-15 16:56:06.753,6402,
4453,6540,0,"Hi, not quite sure what you are asking.  Great queation (s) though.",2017-02-15 18:38:19.567,6366,
4454,6540,0,"Hi! What is not clear? Please, help me to improve this question.",2017-02-15 21:57:32,6402,
4455,6540,1,"Hi, I did a little bit of editing which will be looked at by others first.  I don't like doing this as I believe it is your question not mine, but you did ask me so I hope that what I have done is OK.  I found your wikipedia article very  interesting.",2017-02-16 06:00:05.547,6366,
4456,6536,0,"You got there before me, I believe it was a bit of a revelation when it first came out.",2017-02-16 06:37:05.123,6366,
4457,6537,1,"This. For as far as i know, you can mix alcohol with anything. It might not always be more tastier and can create weird side effects in the mix, depending on the booze used(Baileys and cola is not a good combination, for example).",2017-02-16 08:37:41.897,6210,
4458,6541,1,Chattahoochee!!,2017-02-16 13:30:48.79,1077,
4459,6537,1,If you can eat and or drink it alone then you can mix with alcohol.  But it is hard to prove a negative so not going to say nothing.,2017-02-16 13:37:40.533,4903,
4460,6541,0,English might be a better fit for this but I think it is OK here also.,2017-02-16 13:39:03.733,4903,
4461,6541,0,"Yup, I thought about that - if anyone wants it migrated that is not a problem.",2017-02-16 13:45:53.76,6366,
4463,6540,0,"Thank you very much instead! You did the right thing, I haven't a perfect knowledge of English unfortunately. I need more exercise. ;)",2017-02-17 08:23:54.363,6402,
4464,6540,0,Your English is fantastic - keeping the questions and answers coming will help as well.,2017-02-17 08:57:41.007,6366,
4465,6547,0,I had never heard of Black Cow before - fascinating stuff.,2017-02-18 06:50:39.237,6366,
4466,6534,0,If I let people try the 20ft spitting thing our neighbors would complain!,2017-02-18 07:46:12.9,6366,
4467,6549,2,I prefer your answer to my own.,2017-02-18 07:58:47.843,6366,
4468,6546,0,It's called cheese!,2017-02-18 13:57:01.447,6111,
4469,6525,0,"4 days, 13 bars and none of them serves this whiskey cold. But I will keep trying!",2017-02-18 19:01:35.653,6386,
4470,6452,0,"Well, it's only feb, but what the heck - I'm off to make some eggnog just 'cos this got me thinking - nice answer.",2017-02-19 07:44:15.62,6366,
4471,6551,0,"Hi, and welcome!  What wine are you using in your sauce?",2017-02-19 13:50:31.36,6366,
4472,6551,0,"Also, the cheese, can you tell us a bit more, please.",2017-02-19 13:52:03.84,6366,
4473,6551,0,http://winefolly.com/tutorial/10-darkest-full-bodied-red-wines/  try this site  for starters to your question.,2017-02-19 13:54:20.6,6366,
4475,6551,0,@dougal: Thank you. I've added some links.,2017-02-19 14:30:49.55,6422,
4477,6552,3,How about what your companion prefers?,2017-02-19 15:42:58.103,6370,
4478,6552,0,"Ah, well that is why I put the no can't have this that and the other requirements - for various reasons certain things are out, but I want it to be a surprise.  On the whole though, mr dougal can drink anything except red wine.  It's dougal who can't drink the other stuff, so I want us both to enjoy something together and not have to resort to two different things, as is normal.  Any suggestions - I'm fairly open to anything (alcoholic)!",2017-02-19 15:51:39.363,6366,
4479,6552,0,"What sort of engagement are we talking here? Is this a blind date? Fancy, aged red wine for good first impression type deal? Or, is this for your main squeeze? Sex on the Beach would be an option type deal?",2017-02-19 16:11:49.18,5847,
4480,6556,0,"Thanks! Indeed I have used a Chianti, fantastic. However, under suggestion of this [Italian site](http://www.saporiacasatua.com/prodotto/cacio-fiore/) I used a Gasperini and I appreciated the result. Though, I would like to go for a liquorous wine now, which will be even better, in my opinion. Do you have some in mind?",2017-02-19 16:23:37.17,6422,
4481,6556,0,"@VincenzoOliva How exactly do you define a liquorous red wine: a fortified red wine, a red wine mixed with a liqueur or liquor or something else?",2017-02-19 16:37:48.17,5064,
4482,6556,0,"Oops, I see that maybe the use of the word differs from Italian to English. Yeah, fortified red wine.",2017-02-19 16:49:02.993,6422,
4483,6551,0,"Hi am thinking about the slightly bitter taste that the cheese gives - but beforehand, do you think that the bitterness and the lack of salt is an issue.  Great info by the way - interesting articles.",2017-02-19 16:49:06.52,6366,
4484,6555,0,"ah ha, any suggestions?",2017-02-19 16:49:47.453,6366,
4485,6552,0,I like the sex on the beach idea!  Especially as we live on a boat and beaches are always near.  No we have been together since since - well - I am so old now I cant remember!  It's just a 'Hey let's be romantic 'cos I still sort of love you evening'.  OK OK you can all go and be sick now!,2017-02-19 16:51:59.383,6366,
4486,6554,0,"I hate to say it but OMG.  I have spent a lot of time in the Caribbean and in one bar for St patricks's day they served green, yes I did say green beer (larger), no one bought it and for a long time thereafter green beer was on offer in the bar - god knows what it did to people's kidneys!",2017-02-19 16:58:57.327,6366,
4487,6551,0,"@dougal: I guess it needs to be accounted for. As I wrote in a comment to the answer below, the Gasperini goes well with it.",2017-02-19 17:10:03.017,6422,
4488,6551,0,Sorry I might have been behind the times with your comments etc.  It is great that you are getting feedback and info - also the rest of us are learning something.  By the way can I come for dinner?  Pleaseeeeeeeeeeee!,2017-02-19 17:12:09.253,6366,
4489,6551,0,@dougal: Ahahahah sure you can! ,2017-02-19 17:23:15.577,6422,
4490,4851,0,"Not all beers are kosher.  Beers that have additives or that are aged in wine barrels have additional considerations -- they *can* be, but you can't *assume* it.",2017-02-19 17:41:49.027,43,
4492,6555,0,@dougal3.0.0  Please see my edits including a beer suggestion.,2017-02-19 19:51:51.45,6370,
4493,6553,1,"Plus, if you put green food coloring in Guinness it wouldn't make a bit of difference! ;-)",2017-02-19 23:19:34.81,6111,
4494,6556,0,How is Chianti and Sangiovese an answer to this question? They are not fortified.,2017-02-19 23:22:34.5,6111,
4495,6556,0,@SteveS. Read the complete answer.,2017-02-19 23:32:33.033,5064,
4496,6556,0,"I've been thinking, is there some particular reason you think a Madeira would fare better than a Marsala ruby?",2017-02-20 03:29:24.197,6422,
4498,6555,0,"Sadly any beer, even the Belgium stuff is out...  And I agree, a 'posh' beer in a large stemmed glass does look nice.  I'm thinking of going all out for a super sonic 'Del boy' type cocktail though just for a laugh (complete with umbrella!).",2017-02-20 05:34:07.923,6366,
4499,6556,0,@VincenzoOliva I have enjoyed Madeira in the past and am hoping you would also.,2017-02-20 05:50:39.17,5064,
4500,6556,0,@KenGraham: :D Thanks again.,2017-02-20 06:31:33.963,6422,
4501,6555,0,"@dougal3.0.0  oh well, you did ask for a beer suggestion. Best of luck.",2017-02-20 13:11:21.89,6370,
4502,6556,0,@ken just throwing Madeira at the end is not a good answer. I can recommend several really nice wines that are not fortified. But that's not what you asked for.,2017-02-20 14:32:41.86,6111,
4504,6560,0,https://www.beeradvocate.com/beer/profile/404/2373/.  I'm doing a bit of digging as this has intrigued me - if I find anything I will let you know ASAP.,2017-02-21 07:32:49.187,6366,
4505,6560,1,http://www.mensjournal.com/expert-advice/the-11-best-chocolate-beers-20160205/rogue-double-chocolate-stout.  Also found this.,2017-02-21 08:21:45.817,6366,
4506,6552,0,@dougal3.0.0 are you somewhere that you could get sparkling mead or is it off the list?,2017-02-21 11:47:53.45,909,
4507,6552,0,"Thanks for the input, but that too is off the list - life can be a right pain in the $%^& at times!",2017-02-21 12:20:09.077,6366,
4508,6546,0,[Rennet](https://en.wikipedia.org/wiki/Rennet) is used to separate milk into solid curds for cheesemaking and liquid whey. [Kefir](https://en.wikipedia.org/wiki/Kefir) is made by using [kefir grains](http://www.culturesforhealth.com/milk-kefir-grains.html) which ferments various types of milk.,2017-02-21 12:36:16.92,5064,
4509,6565,7,"I don't know if that would qualify as a ""drink.""  Ethanol above 95.6% cannot be made via fractional distillation.  To go above that, you have to do chemistry using compounds like benzene or heptane, some of which will almost certainly remain behind with the ethanol.",2017-02-21 17:38:44.527,6433,
4510,6565,1,Are you sure that is food (drinking) grade?,2017-02-21 17:41:16.637,4903,
4511,6565,1,99.5% Ethanol and .5% Benzene isn't going to kill you if you take a shot of it! ;-),2017-02-21 17:51:41.657,6111,
4513,6565,0,"Yah, but what will really kill you? Remember we are talking 96%+ ethanol, which if I remember correctly is a carcinogen also? Right?",2017-02-21 18:39:25.973,6111,
4515,6565,1,"Is this available through 'normal' outlets - shops, supermarkets, off licenses etc...?",2017-02-21 19:00:14.003,5064,
4516,6567,10,The next step is [to use sticky rice as a adsorptant](https://www.researchgate.net/publication/288157359_Design_of_adsorptive_distillation_for_separation_of_ethanol-water_azeotropic_mixture_using_bio-based_adsorbents) to get you to 99.9% ethanol purity :),2017-02-21 19:20:55.92,1069,
4517,6565,0,"Yes and no. If you are involved in any kind of scientific research, it's easy to get. I know when I was a winemaker, I could just walk into my local scientific supply house and buy some, but you need to know where to look.",2017-02-21 19:24:06.607,6111,
4518,6563,1,I believe the upper limit for yeast fermentation is somewhere around 25-30%.  Do they get all the way to 67.5% by ice removal or is there some distillation involved too?,2017-02-21 19:24:14.647,1069,
4519,6563,1,Yea freeze distillation is how they get the high percentage,2017-02-21 20:50:46.66,5078,
4520,6564,0,Brilliant!  'I only bought this to get the medicinal properties out of plants' - whilst standing sideways at the checkout with a trolley load of the stuff.  Thanks for this answer.,2017-02-22 06:07:19.293,6366,
4521,6568,0,It would be a self limiting exercise for 'young binge drinkers' !,2017-02-22 06:10:40.253,6366,
4522,6561,0,"On some islands in the Caribbean meths is sold next to the rum - so you go down the isle starting with 'drinkable' rums, go past the white jack (70%) and there you will find the meths!  But that is not what I am looking for.",2017-02-22 06:27:15.187,6366,
4523,6565,0,I feel a hangover coming on just reading about this!,2017-02-22 06:29:38.61,6366,
4578,6582,0,"I suppose you could, if you were looking for thickness. Would it change the taste? I was thinking that the egg white was for the frothy foam top. The old bar method was gum syrup/sirop de gomme which had gum arabic in it.",2017-02-24 14:47:11.483,6391,
4524,6346,0,"I have a vape (now I have two addictions!), and when I use the fruity flavored liquid, to be honest it tastes no different when 'vaped' than any other liquid.  And somehow it just doesn't quite 'cut' it 'do the job' of a sit down with a drink and a cigarette...",2017-02-22 07:00:47.623,6366,
4527,6565,0,"@Mrkvička it's not like the properties of alcohol poisoning would be much different between 99.5% anhydrous ethanol, 96% ethanol or a 80% almost-ethanol drink.",2017-02-22 08:01:46.81,427,
4528,6565,0,"@SteveS Actually, it might. If you get more than 400 mg ethanol per dl blood, then you risk coma and respiratory failure. An average adult contains ~50 dl blood, which means that ~20000 mg is near the limit. Furthermore, the density of ethanol is 0.7893 g/ml = 78930 mg/dl. This means that you can only consume little more than 0.25 dl to reach dangerous concentrations (counting on that all you consume is reaching the blood stream). So a 4 cl shot (1.35 oz) can be survived, but you may actually die from it (depending on your tolerance and how quick people around you react).",2017-02-22 08:15:54.197,6440,
4529,6565,0,"@Peteris I miscalculated severely and deleted that comment as it was too late to edit it. All in all, the answer is nearly the same regardless if the concentration is 99.5% or 80%, it just varies how large shot one can take as the lower concentration means that there is more water in it (a 4 cl shot of 99.5% contains roughly the same amount of ethanol as a 5 cl shot of 80%)",2017-02-22 08:16:30.883,6440,
4532,6570,2,Kehlenschneider is german for throat slicer.,2017-02-22 12:31:49.52,6449,
4533,6563,2,"In my opinion, anything that has been freeze distilled is no longer beer. I don't know what it _is_ but it sure as heck ain't beer!",2017-02-22 13:14:00.977,691,
4534,6563,1,@JackAidley I have tried snake venom and it sure does taste like a beer,2017-02-22 13:50:44.97,5078,
4535,6563,0,@JamieEltringham: I have not had Snake Venom but I have had Brewdog's  Sink The Bismarck. It did not taste like beer :),2017-02-22 13:57:30.297,691,
4538,6563,1,@JackAidley I too have tried Sink The Bismarck and I agree :),2017-02-22 13:59:18.02,5078,
4539,6561,0,"They sell country made wines in few slums in India that have huge amount of Alcohol, needless to say often poisonous.",2017-02-22 07:45:46.29,6441,
4542,6563,0,"Above ~8% it becomes ""Barley wine"". Then after ~15% I don't know what.",2017-02-22 15:57:16.287,6455,
4545,6573,1,"Wow, the hangover just keeps on getting worse and worse!",2017-02-23 04:50:04.12,6366,
4546,6570,0,The scoville scale info on wikipedia was fascinating.  For anyone else interested here is the link https://en.wikipedia.org/wiki/Scoville_scale,2017-02-23 05:26:51.01,6366,
4547,6573,0,The link to the top ten is great - I am marking this as the best answer as it goes above and beyond answering my question - thank you.,2017-02-23 07:15:27.7,6366,
4548,6561,1,Tennent's Super no longer cutting it for you?,2017-02-23 09:36:22.87,6470,
4550,6539,0,bud light is not beer and should not be in any discussion about beer.,2017-02-23 11:53:07.547,6473,
4551,6568,0,"Of course, Polish people don't drink it raw, they mix it beforehand… With breakfast cereals.",2017-02-23 13:21:36.5,6476,
4552,6573,0,It even attacks the can…,2017-02-23 13:24:20.583,6476,
4553,6577,1,"I think it's also worth noting that, at least to my knowledge, only the draught variant is made using *nitrogen* besides the usual CO2, whereas the bottled only uses CO2. This vastly changes the taste of the beer as well. If anything, you should only buy *canned draught*, which is the closest to a freshly tapped one.",2017-02-23 14:17:42.993,6477,
4554,6561,0,"Tennent's was good at 9% strength, but for some reason it's been cut to 8%, and the taste has gone with it.",2017-02-23 16:17:21.037,6479,
4555,6576,1,"I've never had Cocoroco, let me know what it's like. Keep up the good questions. Cheers.",2017-02-23 16:20:29.883,5974,
4556,6573,2,Also highly flammable.,2017-02-23 16:49:10.55,6480,
4557,6539,0,https://www.theatlantic.com/health/archive/2012/11/light-beer-you-dont-have-to-like-it-but-respect-it/264392/,2017-02-23 18:11:24.893,381,
4558,6577,0,"Guinness Extra Stout is a different recipe than Guinness Draft, and I have never seen it on tap anywhere (including Ireland). That accounts for the difference in flavor: GES is higher original gravity and uses more hops to balance the additional malt. If you want to compare bottled Guinness vs Guinness on tap, compare it with the Guinness Draught bottles or cans, both of which contain a widget. This is essentially the same recipe as the Guinness served on tap.",2017-02-23 18:17:38.693,381,
4559,6577,0,"Also, no matter how poorly it is handled, beer cannot be made ""unhealthy"". Its pH is too low to support the growth of pathogens. Wort-spoiling bacteria and wild yeasts/mold will grow in it, but they will only spoil the flavor, not make you sick.",2017-02-23 18:19:50.79,381,
4560,6582,1,Would you be okay with egg white or meringue powder?,2017-02-23 21:04:38.397,6391,
4564,267,0,"WOW, I had never heard of bacon in beer before, probably not for me, but very interesting.",2017-02-24 03:51:09.06,6366,
4566,6581,0,"Wow, now the average bar-tender needs a degree in maths just to mix my drinks!  Fantastic answer.",2017-02-24 03:56:48.317,6366,
4567,6584,0,How do you pasteurize an egg?,2017-02-24 04:04:36.507,6366,
4568,6583,0,A bit like a nice runny yolk in a fried egg. Yum yum!,2017-02-24 04:05:36.187,6366,
4569,6582,0,@Dorothy.  what about something like guar gum to give thickness - just a thought.,2017-02-24 04:06:26.59,6366,
4570,6581,0,Mind you these day they probably do have one - so no sweat there then!,2017-02-24 04:08:27.837,6366,
4571,6586,0,And still the hangover continues?,2017-02-24 05:00:01.857,6366,
4572,6576,0,"Ummm - for now I'm sticking with the baileys chocolate mouse - and building up to a bigger hangover for the weekend.  If/when I do try the cocoroco I will let you know - great answer by the way, thanks.",2017-02-24 06:59:11.407,6366,
4574,6589,0,"Hi, and welcome to our little corner!  Great answer, and I hope that I have edited your links correctly, (I'm not wearing my glasses, so it can be a bit hit and miss without them!).  If not, ping me back and I will get onto it if no one else comes along.",2017-02-24 10:31:35.547,6366,
